<!ELEMENT j8583-config ( header*, template*, parse* ) >

<!ELEMENT header ( #PCDATA ) >
<!ATTLIST header type NMTOKEN #REQUIRED >
<!ATTLIST header ref NMTOKEN #IMPLIED >
<!ATTLIST header binary ( true | false ) #IMPLIED >

<!ELEMENT template ( field* ) >
<!ATTLIST template type NMTOKEN #REQUIRED >
<!ATTLIST template extends NMTOKEN #IMPLIED >

<!ELEMENT parse ( field* ) >
<!ATTLIST parse type NMTOKEN #REQUIRED >
<!ATTLIST parse extends NMTOKEN #IMPLIED >

<!ELEMENT field ( #PCDATA|field )* >
<!ATTLIST field num NMTOKEN #REQUIRED >
<!ATTLIST field length NMTOKEN #IMPLIED >
<!ATTLIST field type ( ALPHA | NUMERIC | AMOUNT | DATE4 | DATE6 | DATE10 | DATE12 | DATE14 | DATE_EXP | TIME | LLVAR | LLLVAR | LLLLVAR | BINARY | LLBIN | LLLBIN | LLLLBIN | LLBCDBIN | LLLBCDBIN | LLLLBCDBIN | exclude) #REQUIRED >
