<?xml version="1.0" encoding="UTF-8"?>
<!DOCTYPE j8583-config PUBLIC "-//J8583//DTD CONFIG 1.0//EN" "http://j8583.sourceforge.net/j8583.dtd">
<j8583-config>

    <template type="0800">
        <field num="7" type="DATE10">1201145101</field>
        <field num="11" type="NUMERIC" length="6">562040</field>
        <field num="70" type="NUMERIC" length="3">270</field>
    </template>


    <parse type="0810">
        <field num="7" type="DATE10"/>
        <field num="11" type="NUMERIC" length="6"/>
        <field num="37" type="ALPHA" length="12"/>
        <field num="39" type="NUMERIC" length="2"/>
        <field num="70" type="NUMERIC" length="3"/>
    </parse>

</j8583-config>