<?xml version="1.0" encoding="UTF-8"?>
<!DOCTYPE j8583-config PUBLIC "-//J8583//DTD CONFIG 1.0//EN"
	"http://j8583.sourceforge.net/j8583.dtd">
<j8583-config>
<!-- This is a test config file -->

    <template type="100">
    	<field num="10" type="LLLVAR">
    		<field num="1" type="ALPHA" length="5">abcde</field>
    		<field num="2" type="LLVAR">llvar</field>
    		<field num="3" type="NUMERIC" length="5">12345</field>
    		<field num="4" type="ALPHA" length="1">X</field>
    	</field>
    </template>

    <template type="101">
    	<field num="10" type="LLLVAR">
            <field num="1" type="ALPHA" length="5">fghij</field>
    		<field num="2" type="LLVAR">
                <field num="1" type="ALPHA" length="2">KL</field>
                <field num="2" type="ALPHA" length="2">mn</field>
                <field num="3" type="LLVAR">
                    <field num="1" type="ALPHA" length="3">123</field>
                    <field num="2" type="ALPHA" length="2">45</field>
                </field>
            </field>
    		<field num="3" type="NUMERIC" length="5">67890</field>
    		<field num="4" type="ALPHA" length="1">Y</field>
    	</field>
    </template>

    <template type="102" extends="101">
        <field num="12" type="LLLVAR">
            <field num="1" type="ALPHA" length="5">fghij</field>
            <field num="2" type="LLVAR">
                <field num="1" type="ALPHA" length="2">KL</field>
                <field num="2" type="ALPHA" length="2">mn</field>
                <field num="3" type="LLVAR">
                    <field num="1" type="ALPHA" length="3">123</field>
                    <field num="2" type="ALPHA" length="2">45</field>
                </field>
            </field>
            <field num="3" type="NUMERIC" length="5">67890</field>
            <field num="4" type="ALPHA" length="1">Y</field>
        </field>
    </template>

    <parse type="100">
        <field num="10" type="LLLVAR">
            <field num="1" type="ALPHA" length="5" />
            <field num="2" type="LLVAR"/>
            <field num="3" type="NUMERIC" length="5" />
            <field num="4" type="ALPHA" length="1" />
        </field>
    </parse>

    <parse type="101">
        <field num="10" type="LLLVAR">
            <field num="1" type="ALPHA" length="5" />
            <field num="2" type="LLVAR">
                <field num="1" type="ALPHA" length="2" />
                <field num="2" type="ALPHA" length="2" />
                <field num="3" type="LLVAR">
                    <field num="1" type="ALPHA" length="3" />
                    <field num="2" type="ALPHA" length="2" />
                </field>
            </field>
            <field num="4" type="ALPHA" length="1" />
        </field>
    </parse>

</j8583-config>
